{
  "resolution_id": "PUB-BLOCKER-RES-GREEN-RUN-20260521-202417-001",
  "created_at": "2026-05-22T16:11:26.852Z",
  "source_run_id": "GREEN-RUN-20260521-202417",
  "selected_intake_id": "INTAKE-GREEN-RUN-20260521-202417-001",
  "selected_decision_id": "DECISION-GREEN-RUN-20260521-202417-001",
  "active_approval_id": "APPROVAL-GREEN-RUN-20260521-202417-001",
  "package_id": "DRAFT-CAND-PKG-GREEN-RUN-20260521-202417-001",
  "dry_run_id": "PROMO-DRY-RUN-GREEN-RUN-20260521-202417-001",
  "signoff_id": "SIGNOFF-GREEN-RUN-20260521-202417-001",
  "promotion_packet_candidate_id": "PROMO-PACKET-CAND-GREEN-RUN-20260521-202417-001",
  "status": "private_package_blockers_partially_resolved",
  "private_blocker_resolution_dossier_only": true,
  "not_publication_approval": true,
  "not_real_promotion_packet": true,
  "not_public_preview": true,
  "not_public_record_creation": true,
  "public_publish_allowed": false,
  "real_promotion_packet_allowed": false,
  "public_preview_allowed": false,
  "public_record_creation_allowed": false,
  "remote_write_allowed": false,
  "raw_text_storage_allowed": false,
  "html_storage_allowed": false,
  "blocker_ledger": [
    {
      "blocker_id": "BLOCKER-001",
      "source_signoff_blocker_id": "human legal/governance review required",
      "source_dimension": "legal_review",
      "blocker_type": "human_legal_publication",
      "original_status": "blocked",
      "t070_status": "requires_human_publication_review",
      "resolution_basis": "Requires active legal and governance signoff before publication.",
      "evidence_references": [],
      "remaining_action": "Obtain human legal review clearance.",
      "human_review_required": true
    },
    {
      "blocker_id": "BLOCKER-002",
      "source_signoff_blocker_id": "source quotation review required",
      "source_dimension": "source_quotation_review",
      "blocker_type": "human_legal_publication",
      "original_status": "blocked",
      "t070_status": "requires_human_publication_review",
      "resolution_basis": "Requires verification of all source quotations and citations.",
      "evidence_references": [],
      "remaining_action": "Verify source quotation compliance.",
      "human_review_required": true
    },
    {
      "blocker_id": "BLOCKER-003",
      "source_signoff_blocker_id": "no public-safe narrative approved",
      "source_dimension": "public_narrative_review",
      "blocker_type": "human_legal_publication",
      "original_status": "blocked",
      "t070_status": "requires_human_publication_review",
      "resolution_basis": "Public-safe narrative requires human narrative editor approval.",
      "evidence_references": [],
      "remaining_action": "Approve public narrative content.",
      "human_review_required": true
    },
    {
      "blocker_id": "BLOCKER-004",
      "source_signoff_blocker_id": "no promotion packet created",
      "source_dimension": "technical_private_package_preparation",
      "blocker_type": "technical_private_package",
      "original_status": "blocked",
      "t070_status": "resolved",
      "resolution_basis": "Private promotion-packet candidate package has been successfully compiled and verified locally in T069.",
      "evidence_references": [
        "private-promotion-packet-candidate-latest.json:PROMO-PACKET-CAND-GREEN-RUN-20260521-202417-001"
      ],
      "remaining_action": "None. Private package compilation is complete.",
      "human_review_required": false
    },
    {
      "blocker_id": "BLOCKER-005",
      "source_signoff_blocker_id": "no preview generated",
      "source_dimension": "publication_preview",
      "blocker_type": "human_legal_publication",
      "original_status": "blocked",
      "t070_status": "publication_blocked",
      "resolution_basis": "Public publication preview is strictly disabled. T070 does not create a public preview.",
      "evidence_references": [],
      "remaining_action": "Generate a publication preview when final human review is complete.",
      "human_review_required": true
    },
    {
      "blocker_id": "BLOCKER-006",
      "source_signoff_blocker_id": "no Control Tower public publish approval",
      "source_dimension": "control_tower_approval",
      "blocker_type": "human_legal_publication",
      "original_status": "blocked",
      "t070_status": "publication_blocked",
      "resolution_basis": "Requires ultimate approval from the human Control Tower before remote publication.",
      "evidence_references": [],
      "remaining_action": "Submit the candidate package to the Control Tower for publication approval.",
      "human_review_required": true
    }
  ],
  "safety_flags": {
    "no_raw_html": true,
    "no_long_third_party_text": true,
    "no_secrets": true,
    "no_inc_0014_created": true,
    "no_real_promotion_packet": true,
    "no_public_preview": true,
    "no_public_site_mutation": true,
    "no_publication_approval_granted": true
  }
}
